{
  "anomaly_indices": [],
  "byte_count": 1045,
  "export_root": "aae69af634f328ce701799c7d9e6a7b67403733e0c9f2ddd7de42469e17dcc00",
  "file_sha256": "b22e505a41253078ca52479fc6e02fe309b606acd48fab87038fc2581d2951cb",
  "line_count": 4,
  "profile": "tc-ledger/1",
  "room": "demo-room",
  "verification": {
    "INVALID": 0,
    "MALFORMED": 0,
    "UNSIGNED": 0,
    "UNSUPPORTED_KEY": 0,
    "VALID": 4
  },
  "version": 1
}
